{
  "teamId": 1,
  "referenceValueId": 25034,
  "referenceValueKind": "DEFAULT",
  "environmentId": 1,
  "namespace": "devtron-demo",
  "appStoreVersion": 25034,
  "valuesOverride": {
    "global": {
      "imageRegistry": "",
      "imagePullSecrets": [

      ],
      "storageClass": ""
    },
    "kubeVersion": "",
    "nameOverride": "",
    "fullnameOverride": "",
    "commonLabels": {

    },
    "commonAnnotations": {

    },
    "extraDeploy": [

    ],
    "image": {
      "registry": "docker.io",
      "repository": "bitnami/apache",
      "tag": "2.4.54-debian-11-r23",
      "digest": "",
      "pullPolicy": "IfNotPresent",
      "pullSecrets": [

      ],
      "debug": false
    },
    "git": {
      "registry": "docker.io",
      "repository": "bitnami/git",
      "tag": "2.37.1-debian-11-r11",
      "digest": "",
      "pullPolicy": "IfNotPresent",
      "pullSecrets": [

      ]
    },
    "replicaCount": 1,
    "podAffinityPreset": "",
    "podAntiAffinityPreset": "soft",
    "nodeAffinityPreset": {
      "type": "",
      "key": "",
      "values": [

      ]
    },
    "affinity": {

    },
    "nodeSelector": {

    },
    "tolerations": [

    ],
    "topologySpreadConstraints": [

    ],
    "extraPodSpec": {

    },
    "cloneHtdocsFromGit": {
      "enabled": false,
      "repository": "",
      "branch": "",
      "enableAutoRefresh": true,
      "interval": 60,
      "resources": {

      },
      "extraVolumeMounts": [

      ]
    },
    "htdocsConfigMap": "",
    "htdocsPVC": "",
    "vhostsConfigMap": "",
    "httpdConfConfigMap": "",
    "podLabels": {

    },
    "podAnnotations": {

    },
    "hostAliases": [
      {
        "ip": "127.0.0.1",
        "hostnames": [
          "status.localhost"
        ]
      }
    ],
    "priorityClassName": "",
    "schedulerName": "",
    "podSecurityContext": {
      "enabled": true,
      "fsGroup": 1001
    },
    "containerSecurityContext": {
      "enabled": true,
      "runAsUser": 1001,
      "runAsNonRoot": true
    },
    "command": [

    ],
    "args": [

    ],
    "lifecycleHooks": {

    },
    "resources": {
      "limits": {

      },
      "requests": {

      }
    },
    "startupProbe": {
      "enabled": false,
      "path": "/",
      "port": "http",
      "initialDelaySeconds": 180,
      "periodSeconds": 20,
      "timeoutSeconds": 5,
      "failureThreshold": 6,
      "successThreshold": 1
    },
    "livenessProbe": {
      "enabled": true,
      "path": "/",
      "port": "http",
      "initialDelaySeconds": 180,
      "periodSeconds": 20,
      "timeoutSeconds": 5,
      "failureThreshold": 6,
      "successThreshold": 1
    },
    "readinessProbe": {
      "enabled": true,
      "path": "/",
      "port": "http",
      "initialDelaySeconds": 30,
      "periodSeconds": 10,
      "timeoutSeconds": 5,
      "failureThreshold": 6,
      "successThreshold": 1
    },
    "customStartupProbe": {

    },
    "customLivenessProbe": {

    },
    "customReadinessProbe": {

    },
    "extraVolumes": [

    ],
    "extraVolumeMounts": [

    ],
    "extraEnvVars": [

    ],
    "extraEnvVarsCM": "",
    "extraEnvVarsSecret": "",
    "containerPorts": {
      "http": 8080,
      "https": 8443
    },
    "initContainers": [

    ],
    "sidecars": [

    ],
    "updateStrategy": {
      "type": "RollingUpdate"
    },
    "pdb": {
      "create": false,
      "minAvailable": 1,
      "maxUnavailable": ""
    },
    "autoscaling": {
      "enabled": false,
      "minReplicas": 1,
      "maxReplicas": 11,
      "targetCPU": 50,
      "targetMemory": 50
    },
    "service": {
      "type": "ClusterIP",
      "ports": {
        "http": 80,
        "https": 443
      },
      "nodePorts": {
        "http": "",
        "https": ""
      },
      "clusterIP": "",
      "loadBalancerIP": "",
      "loadBalancerSourceRanges": [

      ],
      "annotations": {

      },
      "externalTrafficPolicy": "Cluster",
      "extraPorts": [

      ],
      "sessionAffinity": "None",
      "sessionAffinityConfig": {

      }
    },
    "ingress": {
      "enabled": false,
      "selfSigned": false,
      "pathType": "ImplementationSpecific",
      "apiVersion": "",
      "ingressClassName": "",
      "hostname": "example.local",
      "path": "/",
      "annotations": {

      },
      "tls": [
        {
          "hosts": [
            "example.local"
          ],
          "secretName": "example.local-tls"
        }
      ],
      "hosts": [

      ],
      "extraHosts": [

      ],
      "extraPaths": [

      ],
      "extraTls": [

      ],
      "secrets": [

      ],
      "extraRules": [

      ]
    },
    "metrics": {
      "enabled": false,
      "image": {
        "registry": "docker.io",
        "repository": "bitnami/apache-exporter",
        "tag": "0.11.0-debian-11-r28",
        "digest": "",
        "pullPolicy": "IfNotPresent",
        "pullSecrets": [

        ],
        "debug": false
      },
      "podAnnotations": {
        "prometheus.io/scrape": "true",
        "prometheus.io/port": "9117"
      },
      "resources": {
        "limits": {

        },
        "requests": {

        }
      },
      "service": {
        "port": 9117,
        "annotations": {
          "prometheus.io/scrape": "true",
          "prometheus.io/port": "{{ .Values.metrics.service.port }}"
        }
      },
      "serviceMonitor": {
        "enabled": false,
        "namespace": "",
        "interval": "",
        "scrapeTimeout": "",
        "labels": {

        },
        "relabelings": [

        ],
        "metricRelabelings": [

        ]
      },
      "prometheusRule": {
        "enabled": false,
        "namespace": "",
        "labels": {

        },
        "rules": [

        ]
      }
    }
  },
  "valuesOverrideYaml": "## @section Global parameters\n## Global Docker image parameters\n## Please, note that this will override the image parameters, including dependencies, configured to use the global value\n## Current available global Docker image parameters: imageRegistry, imagePullSecrets and storageClass\n\n## @param global.imageRegistry Global Docker image registry\n## @param global.imagePullSecrets Global Docker registry secret names as an array\n## @param global.storageClass Global StorageClass for Persistent Volume(s)\n##\nglobal:\n  imageRegistry: \"\"\n  ## E.g.\n  ## imagePullSecrets:\n  ##   - myRegistryKeySecretName\n  ##\n  imagePullSecrets: []\n  storageClass: \"\"\n\n## @section Common parameters\n\n## @param kubeVersion Override Kubernetes version\n##\nkubeVersion: \"\"\n## @param nameOverride String to partially override common.names.fullname\n##\nnameOverride: \"\"\n## @param fullnameOverride String to fully override common.names.fullname\n##\nfullnameOverride: \"\"\n## @param commonLabels Labels to add to all deployed objects\n##\ncommonLabels: {}\n## @param commonAnnotations Annotations to add to all deployed objects\n##\ncommonAnnotations: {}\n## @param extraDeploy Array of extra objects to deploy with the release\n##\nextraDeploy: []\n\n## @section Apache parameters\n\n## Bitnami Apache image\n## ref: https://hub.docker.com/r/bitnami/apache/tags/\n## @param image.registry Apache image registry\n## @param image.repository Apache image repository\n## @param image.tag Apache image tag (immutable tags are recommended)\n## @param image.digest Apache image digest in the way sha256:aa.... Please note this parameter, if set, will override the tag\n## @param image.pullPolicy Apache image pull policy\n## @param image.pullSecrets Apache image pull secrets\n## @param image.debug Enable image debug mode\n##\nimage:\n  registry: docker.io\n  repository: bitnami/apache\n  tag: 2.4.54-debian-11-r23\n  digest: \"\"\n  ## Specify a imagePullPolicy\n  ## Defaults to 'Always' if image tag is 'latest', else set to 'IfNotPresent'\n  ## ref: https://kubernetes.io/docs/user-guide/images/#pre-pulling-images\n  ##\n  pullPolicy: IfNotPresent\n  ## Optionally specify an array of imagePullSecrets.\n  ## Secrets must be manually created in the namespace.\n  ## ref: https://kubernetes.io/docs/tasks/configure-pod-container/pull-image-private-registry/\n  ## e.g:\n  ## pullSecrets:\n  ##   - myRegistryKeySecretName\n  ##\n  pullSecrets: []\n  ## Enable debug mode\n  ##\n  debug: false\n## Bitnami Git image version\n## ref: https://hub.docker.com/r/bitnami/git/tags/\n## @param git.registry Git image registry\n## @param git.repository Git image name\n## @param git.tag Git image tag (immutable tags are recommended)\n## @param git.digest Git image digest in the way sha256:aa.... Please note this parameter, if set, will override the tag\n## @param git.pullPolicy Git image pull policy\n## @param git.pullSecrets Specify docker-registry secret names as an array\n##\ngit:\n  registry: docker.io\n  repository: bitnami/git\n  tag: 2.37.1-debian-11-r11\n  digest: \"\"\n  pullPolicy: IfNotPresent\n  ## Optionally specify an array of imagePullSecrets.\n  ## Secrets must be manually created in the namespace.\n  ## ref: https://kubernetes.io/docs/tasks/configure-pod-container/pull-image-private-registry/\n  ## e.g:\n  ## pullSecrets:\n  ##   - myRegistryKeySecretName\n  ##\n  pullSecrets: []\n## @param replicaCount Number of replicas of the Apache deployment\n##\nreplicaCount: 1\n## @param podAffinityPreset Pod affinity preset. Ignored if `affinity` is set. Allowed values: `soft` or `hard`\n## ref: https://kubernetes.io/docs/concepts/scheduling-eviction/assign-pod-node/#inter-pod-affinity-and-anti-affinity\n##\npodAffinityPreset: \"\"\n## @param podAntiAffinityPreset Pod anti-affinity preset. Ignored if `affinity` is set. Allowed values: `soft` or `hard`\n## Ref: https://kubernetes.io/docs/concepts/scheduling-eviction/assign-pod-node/#inter-pod-affinity-and-anti-affinity\n##\npodAntiAffinityPreset: soft\n## Node affinity preset\n## Ref: https://kubernetes.io/docs/concepts/scheduling-eviction/assign-pod-node/#node-affinity\n##\nnodeAffinityPreset:\n  ## @param nodeAffinityPreset.type Node affinity preset type. Ignored if `affinity` is set. Allowed values: `soft` or `hard`\n  ##\n  type: \"\"\n  ## @param nodeAffinityPreset.key Node label key to match. Ignored if `affinity` is set\n  ##\n  key: \"\"\n  ## @param nodeAffinityPreset.values Node label values to match. Ignored if `affinity` is set\n  ## E.g.\n  ## values:\n  ##   - e2e-az1\n  ##   - e2e-az2\n  ##\n  values: []\n## @param affinity Affinity for pod assignment\n## Ref: https://kubernetes.io/docs/concepts/configuration/assign-pod-node/#affinity-and-anti-affinity\n## NOTE: podAffinityPreset, podAntiAffinityPreset, and nodeAffinityPreset will be ignored when it's set\n##\naffinity: {}\n## @param nodeSelector Node labels for pod assignment\n## ref: https://kubernetes.io/docs/user-guide/node-selection/\n##\nnodeSelector: {}\n## @param tolerations Tolerations for pod assignment\n## ref: https://kubernetes.io/docs/concepts/configuration/taint-and-toleration/\n##\ntolerations: []\n## @param topologySpreadConstraints Topology Spread Constraints for pod assignment spread across your cluster among failure-domains. Evaluated as a template\n## Ref: https://kubernetes.io/docs/concepts/workloads/pods/pod-topology-spread-constraints/#spread-constraints-for-pods\n##\ntopologySpreadConstraints: []\n## @param extraPodSpec Optionally specify extra PodSpec\n##\nextraPodSpec: {}\n## Get the server static content from a git repository\n## @param cloneHtdocsFromGit.enabled Get the server static content from a git repository\n## @param cloneHtdocsFromGit.repository Repository to clone static content from\n## @param cloneHtdocsFromGit.branch Branch inside the git repository\n## @param cloneHtdocsFromGit.enableAutoRefresh Enables an automatic git pull with a sidecar container\n## @param cloneHtdocsFromGit.interval Interval for sidecar container pull from the repository\n## @param cloneHtdocsFromGit.resources Init container git resource requests\n## @param cloneHtdocsFromGit.extraVolumeMounts Add extra volume mounts for the GIT containers\n##\ncloneHtdocsFromGit:\n  enabled: false\n  repository: \"\"\n  branch: \"\"\n  enableAutoRefresh: true\n  interval: 60\n  resources: {}\n  ## Useful to mount keys to connect through ssh. (normally used with extraVolumes)\n  ## E.g:\n  ## extraVolumeMounts:\n  ##   - name: ssh-dir\n  ##     mountPath: /root/.ssh/\n  ##\n  extraVolumeMounts: []\n## @param htdocsConfigMap Name of a config map with the server static content\n##\nhtdocsConfigMap: \"\"\n## @param htdocsPVC Name of a PVC with the server static content\n##\nhtdocsPVC: \"\"\n## @param vhostsConfigMap Name of a config map with the virtual hosts content\n##\nvhostsConfigMap: \"\"\n## @param httpdConfConfigMap Name of a config map with the httpd.conf file contents\n##\nhttpdConfConfigMap: \"\"\n## @param podLabels Extra labels for Apache pods\n## ref: https://kubernetes.io/docs/concepts/overview/working-with-objects/labels/\n##\npodLabels: {}\n## @param podAnnotations Pod annotations\n## ref: https://kubernetes.io/docs/concepts/overview/working-with-objects/annotations/\n##\npodAnnotations: {}\n## @param hostAliases [array] Add deployment host aliases\n## https://kubernetes.io/docs/concepts/services-networking/add-entries-to-pod-etc-hosts-with-host-aliases/\n##\nhostAliases:\n  ## Necessary for apache-exporter to work\n  ##\n  - ip: \"127.0.0.1\"\n    hostnames:\n      - \"status.localhost\"\n## @param priorityClassName Apache Server pods' priorityClassName\n##\npriorityClassName: \"\"\n## @param schedulerName Name of the k8s scheduler (other than default)\n## ref: https://kubernetes.io/docs/tasks/administer-cluster/configure-multiple-schedulers/\n##\nschedulerName: \"\"\n## Configure Pods Security Context\n## ref: https://kubernetes.io/docs/tasks/configure-pod-container/security-context/#set-the-security-context-for-a-pod\n## @param podSecurityContext.enabled Enabled Apache Server pods' Security Context\n## @param podSecurityContext.fsGroup Set Apache Server pod's Security Context fsGroup\n##\npodSecurityContext:\n  enabled: true\n  fsGroup: 1001\n## Configure Container Security Context\n## ref: https://kubernetes.io/docs/tasks/configure-pod-container/security-context/#set-the-security-context-for-a-pod\n## @param containerSecurityContext.enabled Enabled Apache Server containers' Security Context\n## @param containerSecurityContext.runAsUser Set Apache Server containers' Security Context runAsUser\n## @param containerSecurityContext.runAsNonRoot Set Controller container's Security Context runAsNonRoot\n##\ncontainerSecurityContext:\n  enabled: true\n  runAsUser: 1001\n  runAsNonRoot: true\n## @param command Override default container command (useful when using custom images)\n##\ncommand: []\n## @param args Override default container args (useful when using custom images)\n##\nargs: []\n## @param lifecycleHooks for the Apache server container(s) to automate configuration before or after startup\n##\nlifecycleHooks: {}\n## Apache pods' resource requests and limits\n## ref: https://kubernetes.io/docs/user-guide/compute-resources/\n## We usually recommend not to specify default resources and to leave this as a conscious\n## choice for the user. This also increases chances charts run on environments with little\n## resources, such as Minikube. If you do want to specify resources, uncomment the following\n## lines, adjust them as necessary, and remove the curly braces after 'resources:'.\n## @param resources.limits The resources limits for the container\n## @param resources.requests The requested resources for the container\n##\nresources:\n  ## Example:\n  ## limits:\n  ##   cpu: 100m\n  ##   memory: 128Mi\n  limits: {}\n  ## Examples:\n  ## requests:\n  ##   cpu: 100m\n  ##   memory: 128Mi\n  requests: {}\n## Configure extra options for containers' liveness and readiness probes\n## Configure extra options for Apache server containers' liveness, readiness and startup probes\n## ref: https://kubernetes.io/docs/tasks/configure-pod-container/configure-liveness-readiness-probes/#configure-probes)\n## @param startupProbe.enabled Enable startupProbe\n## @param startupProbe.path Path to access on the HTTP server\n## @param startupProbe.port Port for startupProbe\n## @param startupProbe.initialDelaySeconds Initial delay seconds for startupProbe\n## @param startupProbe.periodSeconds Period seconds for startupProbe\n## @param startupProbe.timeoutSeconds Timeout seconds for startupProbe\n## @param startupProbe.failureThreshold Failure threshold for startupProbe\n## @param startupProbe.successThreshold Success threshold for startupProbe\n##\nstartupProbe:\n  enabled: false\n  path: \"/\"\n  port: http\n  initialDelaySeconds: 180\n  periodSeconds: 20\n  timeoutSeconds: 5\n  failureThreshold: 6\n  successThreshold: 1\n## @param livenessProbe.enabled Enable liveness probe\n## @param livenessProbe.path Path to access on the HTTP server\n## @param livenessProbe.port Port for livenessProbe\n## @param livenessProbe.initialDelaySeconds Initial delay seconds for livenessProbe\n## @param livenessProbe.periodSeconds Period seconds for livenessProbe\n## @param livenessProbe.timeoutSeconds Timeout seconds for livenessProbe\n## @param livenessProbe.failureThreshold Failure threshold for livenessProbe\n## @param livenessProbe.successThreshold Success threshold for livenessProbe\n##\nlivenessProbe:\n  enabled: true\n  path: \"/\"\n  port: http\n  initialDelaySeconds: 180\n  periodSeconds: 20\n  timeoutSeconds: 5\n  failureThreshold: 6\n  successThreshold: 1\n## @param readinessProbe.enabled Enable readiness probe\n## @param readinessProbe.path Path to access on the HTTP server\n## @param readinessProbe.port Port for readinessProbe\n## @param readinessProbe.initialDelaySeconds Initial delay seconds for readinessProbe\n## @param readinessProbe.periodSeconds Period seconds for readinessProbe\n## @param readinessProbe.timeoutSeconds Timeout seconds for readinessProbe\n## @param readinessProbe.failureThreshold Failure threshold for readinessProbe\n## @param readinessProbe.successThreshold Success threshold for readinessProbe\n##\nreadinessProbe:\n  enabled: true\n  path: \"/\"\n  port: http\n  initialDelaySeconds: 30\n  periodSeconds: 10\n  timeoutSeconds: 5\n  failureThreshold: 6\n  successThreshold: 1\n## @param customStartupProbe Custom liveness probe for the Web component\n##\ncustomStartupProbe: {}\n## @param customLivenessProbe Custom liveness probe for the Web component\n##\ncustomLivenessProbe: {}\n## @param customReadinessProbe Custom rediness probe for the Web component\n##\ncustomReadinessProbe: {}\n## @param extraVolumes Array to add extra volumes (evaluated as a template)\n##\nextraVolumes: []\n## @param extraVolumeMounts Array to add extra mounts (normally used with extraVolumes, evaluated as a template)\n##\nextraVolumeMounts: []\n## @param extraEnvVars Array to add extra environment variables\n##\nextraEnvVars: []\n## @param extraEnvVarsCM Name of existing ConfigMap containing extra env vars for Apache server nodes\n##\nextraEnvVarsCM: \"\"\n## @param extraEnvVarsSecret Name of existing Secret containing extra env vars for Apache server nodes\n##\nextraEnvVarsSecret: \"\"\n## Apache server container port\n## @param containerPorts.http Apache server HTTP container port\n## @param containerPorts.https Apache server HTTPS container port\n##\ncontainerPorts:\n  http: 8080\n  https: 8443\n## @param initContainers Add additional init containers to the Apache pods\n## Example:\n## initContainers:\n##   - name: your-image-name\n##     image: your-image\n##     imagePullPolicy: Always\n##     ports:\n##       - name: portname\n##         containerPort: 1234\n##\ninitContainers: []\n## @param sidecars Add additional sidecar containers to the Apache pods\n## Example:\n## sidecars:\n##   - name: your-image-name\n##     image: your-image\n##     imagePullPolicy: Always\n##     ports:\n##       - name: portname\n##         containerPort: 1234\n##\nsidecars: []\n\n## @param updateStrategy.type Apache Server deployment strategy type.\n## ref: https://kubernetes.io/docs/concepts/workloads/controllers/deployment/#strategy\n## e.g:\n## updateStrategy:\n##  type: RollingUpdate\n##  rollingUpdate:\n##    maxSurge: 25%\n##    maxUnavailable: 25%\n##\nupdateStrategy:\n  type: RollingUpdate\n\n## @section Other Parameters\n\n## Apache Pod Disruption Budget configuration\n## ref: https://kubernetes.io/docs/tasks/run-application/configure-pdb/\n## @param pdb.create Enable a Pod Disruption Budget creation\n## @param pdb.minAvailable Minimum number/percentage of pods that should remain scheduled\n## @param pdb.maxUnavailable Maximum number/percentage of pods that may be made unavailable\n##\npdb:\n  create: false\n  minAvailable: 1\n  maxUnavailable: \"\"\n\n## Apache Autoscaling parameters\n## ref: https://kubernetes.io/docs/tasks/run-application/horizontal-pod-autoscale/\n## @param autoscaling.enabled Enable Horizontal POD autoscaling for Apache\n## @param autoscaling.minReplicas Minimum number of Apache replicas\n## @param autoscaling.maxReplicas Maximum number of Apache replicas\n## @param autoscaling.targetCPU Target CPU utilization percentage\n## @param autoscaling.targetMemory Target Memory utilization percentage\n##\nautoscaling:\n  enabled: false\n  minReplicas: 1\n  maxReplicas: 11\n  targetCPU: 50\n  targetMemory: 50\n\n## @section Traffic Exposure Parameters\n\n## Apache service parameters\n##\nservice:\n  ## @param service.type Apache Service type\n  ##\n  type: ClusterIP\n  ## @param service.ports.http Apache service HTTP port\n  ## @param service.ports.https Apache service HTTPS port\n  ##\n  ports:\n    http: 80\n    https: 443\n  ## Node ports to expose\n  ## @param service.nodePorts.http Node port for HTTP\n  ## @param service.nodePorts.https Node port for HTTPS\n  ##\n  nodePorts:\n    http: \"\"\n    https: \"\"\n  ## @param service.clusterIP Apache service Cluster IP\n  ## e.g.:\n  ## clusterIP: None\n  ##\n  clusterIP: \"\"\n  ## @param service.loadBalancerIP Apache service Load Balancer IP\n  ## ref: https://kubernetes.io/docs/concepts/services-networking/service/#type-loadbalancer\n  ##\n  loadBalancerIP: \"\"\n  ## @param service.loadBalancerSourceRanges Apache service Load Balancer sources\n  ## ref: https://kubernetes.io/docs/tasks/access-application-cluster/configure-cloud-provider-firewall/#restrict-access-for-loadbalancer-service\n  ## e.g:\n  ## loadBalancerSourceRanges:\n  ##   - 10.10.10.0/24\n  ##\n  loadBalancerSourceRanges: []\n  ## @param service.annotations Additional custom annotations for Apache service\n  ## This can be used to set the LoadBalancer service type to internal only.\n  ## ref: https://kubernetes.io/docs/concepts/services-networking/service/#internal-load-balancer\n  ##\n  annotations: {}\n  ## @param service.externalTrafficPolicy Apache service external traffic policy\n  ## ref https://kubernetes.io/docs/tasks/access-application-cluster/create-external-load-balancer/#preserving-the-client-source-ip\n  ##\n  externalTrafficPolicy: Cluster\n  ## @param service.extraPorts Extra ports to expose (normally used with the `sidecar` value)\n  ##\n  extraPorts: []\n  ## @param service.sessionAffinity Session Affinity for Kubernetes service, can be \"None\" or \"ClientIP\"\n  ## If \"ClientIP\", consecutive client requests will be directed to the same mongos Pod\n  ## ref: https://kubernetes.io/docs/concepts/services-networking/service/#virtual-ips-and-service-proxies\n  ##\n  sessionAffinity: None\n  ## @param service.sessionAffinityConfig Additional settings for the sessionAffinity\n  ## sessionAffinityConfig:\n  ##   clientIP:\n  ##     timeoutSeconds: 300\n  ##\n  sessionAffinityConfig: {}\n## Configure the ingress resource that allows you to access the Apache installation\n## ref: https://kubernetes.io/docs/user-guide/ingress/\n##\ningress:\n  ## @param ingress.enabled Enable ingress record generation for Apache\n  ##\n  enabled: false\n\n  ## @param ingress.selfSigned Create a TLS secret for this ingress record using self-signed certificates generated by Helm\n  ##\n  selfSigned: false\n\n  ## @param ingress.pathType Ingress path type\n  ##\n  pathType: ImplementationSpecific\n  ## @param ingress.apiVersion Force Ingress API version (automatically detected if not set)\n  ##\n  apiVersion: \"\"\n  ## @param ingress.ingressClassName IngressClass that will be be used to implement the Ingress (Kubernetes 1.18+)\n  ## IngressClassName is used to reference the IngressClass that should be used to implement this Ingress.\n  ## This is supported in Kubernetes 1.18+ and required if you have more than one IngressClass marked as the default for your cluster .\n  ## ref: https://kubernetes.io/blog/2020/04/02/improvements-to-the-ingress-api-in-kubernetes-1.18/\n  ##\n  ingressClassName: \"\"\n  ## @param ingress.hostname Default host for the ingress record\n  ##\n  hostname: example.local\n  ## @param ingress.path Default path for the ingress record\n  ##\n  path: /\n  ## @param ingress.annotations Additional annotations for the Ingress resource. To enable certificate autogeneration, place here your cert-manager annotations.\n  ## For a full list of possible ingress annotations, please see\n  ## ref: https://github.com/kubernetes/ingress-nginx/blob/master/docs/user-guide/nginx-configuration/annotations.md\n  ## Use this parameter to set the required annotations for cert-manager, see\n  ## ref: https://cert-manager.io/docs/usage/ingress/#supported-annotations\n  ##\n  ## e.g:\n  ## annotations:\n  ##   kubernetes.io/ingress.class: nginx\n  ##   cert-manager.io/cluster-issuer: cluster-issuer-name\n  ##\n  annotations: {}\n  ## @param ingress.tls [array] Enable TLS configuration for the hosts defined\n  ## ref: https://kubernetes.io/docs/concepts/services-networking/ingress/#tls\n  ##\n  tls:\n    - hosts:\n        - example.local\n      secretName: example.local-tls\n  ## DEPRECATED: Use ingress.annotations instead of ingress.certManager\n  ## certManager: false\n  ##\n\n  ## @param ingress.hosts An array with additional hostname(s) to be covered with the ingress record\n  ## Most likely the hostname above will be enough, but in the event more hosts are needed, this is an array\n  ## e.g:\n  ## hosts:\n  ##   - name: example.local\n  ##     path: /\n  ##\n  hosts: []\n  ## @param ingress.extraHosts An array with additional hostname(s) to be covered with the ingress record\n  ## e.g:\n  ## extraHosts:\n  ##   - name: apache.local\n  ##     path: /\n  ##\n  extraHosts: []\n  ## @param ingress.extraPaths An array with additional arbitrary paths that may need to be added to the ingress under the main host\n  ## e.g:\n  ## extraPaths:\n  ## - path: /*\n  ##   backend:\n  ##     serviceName: ssl-redirect\n  ##     servicePort: use-annotation\n  ##\n  extraPaths: []\n  ## @param ingress.extraTls TLS configuration for additional hostname(s) to be covered with this ingress record\n  ## ref: https://kubernetes.io/docs/concepts/services-networking/ingress/#tls\n  ## e.g:\n  ## extraTls:\n  ## - hosts:\n  ##     - apache.local\n  ##   secretName: apache.local-tls\n  ##\n  extraTls: []\n  ## @param ingress.secrets Custom TLS certificates as secrets\n  ## NOTE: 'key' and 'certificate' are expected in PEM format\n  ## NOTE: 'name' should line up with a 'secretName' set further up\n  ## If it is not set and you're using cert-manager, this is unneeded, as it will create a secret for you with valid certificates\n  ## If it is not set and you're NOT using cert-manager either, self-signed certificates will be created valid for 365 days\n  ## It is also possible to create and manage the certificates outside of this helm chart\n  ## Please see README.md for more information\n  ## e.g:\n  ## secrets:\n  ##   - name: example.local-tls\n  ##     key: |-\n  ##       -----BEGIN RSA PRIVATE KEY-----\n  ##       ...\n  ##       -----END RSA PRIVATE KEY-----\n  ##     certificate: |-\n  ##       -----BEGIN CERTIFICATE-----\n  ##       ...\n  ##       -----END CERTIFICATE-----\n  ##\n  secrets: []\n  ## @param ingress.extraRules Additional rules to be covered with this ingress record\n  ## ref: https://kubernetes.io/docs/concepts/services-networking/ingress/#ingress-rules\n  ## e.g:\n  ## extraRules:\n  ## - host: apache.local\n  ##     http:\n  ##       path: /\n  ##       backend:\n  ##         service:\n  ##           name: apache-svc\n  ##           port:\n  ##             name: http\n  ##\n  extraRules: []\n\n## @section Metrics Parameters\n\nmetrics:\n  ## @param metrics.enabled Start a sidecar prometheus exporter to expose Apache metrics\n  ##\n  enabled: false\n  ## Bitnami Apache Prometheus Exporter image\n  ## ref: https://hub.docker.com/r/bitnami/apache-exporter/tags/\n  ## @param metrics.image.registry Apache Exporter image registry\n  ## @param metrics.image.repository Apache Exporter image repository\n  ## @param metrics.image.tag Apache Exporter image tag (immutable tags are recommended)\n  ## @param metrics.image.digest Apache Exporter image digest in the way sha256:aa.... Please note this parameter, if set, will override the tag\n  ## @param metrics.image.pullPolicy Apache Exporter image pull policy\n  ## @param metrics.image.pullSecrets Apache Exporter image pull secrets\n  ## @param metrics.image.debug Apache Exporter image debug mode\n  ##\n  image:\n    registry: docker.io\n    repository: bitnami/apache-exporter\n    tag: 0.11.0-debian-11-r28\n    digest: \"\"\n    pullPolicy: IfNotPresent\n    ## Optionally specify an array of imagePullSecrets.\n    ## Secrets must be manually created in the namespace.\n    ## ref: https://kubernetes.io/docs/tasks/configure-pod-container/pull-image-private-registry/\n    ## e.g:\n    ## pullSecrets:\n    ##   - myRegistryKeySecretName\n    ##\n    pullSecrets: []\n    ## Enable debug mode\n    ##\n    debug: false\n  ## @param metrics.podAnnotations [object] Additional custom annotations for Apache exporter service\n  ##\n  podAnnotations:\n    prometheus.io/scrape: \"true\"\n    prometheus.io/port: \"9117\"\n  ## Apache Prometheus exporter resource requests and limits\n  ## ref: https://kubernetes.io/docs/user-guide/compute-resources/\n  ## We usually recommend not to specify default resources and to leave this as a conscious\n  ## choice for the user. This also increases chances charts run on environments with little\n  ## resources, such as Minikube. If you do want to specify resources, uncomment the following\n  ## lines, adjust them as necessary, and remove the curly braces after 'resources:'.\n  ## @param metrics.resources.limits The resources limits for the container\n  ## @param metrics.resources.requests The requested resources for the container\n  ##\n  resources:\n    ## Example:\n    ## limits:\n    ##   cpu: 100m\n    ##   memory: 128Mi\n    limits: {}\n    ## Examples:\n    ## requests:\n    ##   cpu: 100m\n    ##   memory: 128Mi\n    requests: {}\n    ## Prometheus exporter service parameters\n  ##\n  service:\n    ## @param metrics.service.port Metrics service port\n    ##\n    port: 9117\n    ## @param metrics.service.annotations [object] Additional custom annotations for Metrics service\n    ##\n    annotations:\n      prometheus.io/scrape: \"true\"\n      prometheus.io/port: \"{{ .Values.metrics.service.port }}\"\n  ## Prometheus Operator PodMonitor configuration\n  ##\n  serviceMonitor:\n    ## @param metrics.serviceMonitor.enabled if `true`, creates a Prometheus Operator PodMonitor (also requires `metrics.enabled` to be `true`)\n    ##\n    enabled: false\n    ## @param metrics.serviceMonitor.namespace Namespace for the PodMonitor Resource (defaults to the Release Namespace)\n    ##\n    namespace: \"\"\n    ## @param metrics.serviceMonitor.interval Interval at which metrics should be scraped.\n    ## ref: https://github.com/coreos/prometheus-operator/blob/master/Documentation/api.md#endpoint\n    ## e.g:\n    ## interval: 10s\n    ##\n    interval: \"\"\n    ## @param metrics.serviceMonitor.scrapeTimeout Timeout after which the scrape is ended\n    ## ref: https://github.com/coreos/prometheus-operator/blob/master/Documentation/api.md#endpoint\n    ## e.g:\n    ## scrapeTimeout: 10s\n    ##\n    scrapeTimeout: \"\"\n    ## @param metrics.serviceMonitor.labels Labels that can be used so PodMonitor will be discovered by Prometheus\n    ##\n    labels: {}\n    ## @param metrics.serviceMonitor.relabelings RelabelConfigs to apply to samples before scraping\n    ##\n    relabelings: []\n    ## @param metrics.serviceMonitor.metricRelabelings MetricRelabelConfigs to apply to samples before ingestion\n    ##\n    metricRelabelings: []\n  ## Prometheus Operator PrometheusRule configuration\n  ##\n  prometheusRule:\n    ## @param metrics.prometheusRule.enabled if `true`, creates a Prometheus Operator PrometheusRule (also requires `metrics.enabled` to be `true` and `metrics.prometheusRule.rules`)\n    ##\n    enabled: false\n    ## @param metrics.prometheusRule.namespace Namespace for the PrometheusRule Resource (defaults to the Release Namespace)\n    ##\n    namespace: \"\"\n    ## @param metrics.prometheusRule.labels Labels that can be used so PrometheusRule will be discovered by Prometheus\n    ##\n    labels: {}\n    ## @param metrics.prometheusRule.rules Prometheus Rule definitions\n    ##   - alert: LowInstance\n    ##     expr: up{service=\"{{ template \"common.names.fullname\" . }}\"} < 1\n    ##     for: 1m\n    ##     labels:\n    ##       severity: critical\n    ##     annotations:\n    ##       description: Service {{ template \"common.names.fullname\" . }} Apache is down since 1m.\n    ##       summary: Apache instance is down.\n    ##\n    rules: []\n",
  "appName": "deepak-apache-cluser"
}